{
  "id": "yoco",
  "name": "Yoco",
  "aliases": ["Yoco Online", "Yoco Checkout", "Yoco Payment Gateway"],
  "homepage": "https://www.yoco.com",
  "docs_url": "https://developer.yoco.com/online/api-reference",
  "category": "sa-gateway",
  "regions": ["South Africa"],
  "countries": ["ZA"],
  "currencies": ["ZAR"],
  "methods": ["card"],
  "auth": {
    "model": "bearer-secret-key",
    "key_types": ["sk_test_", "sk_live_", "pk_test_", "pk_live_", "whsec_"],
    "sandbox_instant": true,
    "kyc_required_for_live": true
  },
  "initiate": {
    "flow": "redirect",
    "endpoint": "POST https://payments.yoco.com/api/checkouts",
    "http_method": "POST",
    "required_params": ["amount", "currency"],
    "returns": ["id", "redirectUrl", "status"],
    "amount_unit": "minor-subunit"
  },
  "status": {
    "mechanisms": ["webhook", "poll", "redirect-return"],
    "webhook_verification": "Svix scheme. Headers 'webhook-id', 'webhook-timestamp', 'webhook-signature'. Strip 'whsec_' prefix, base64-decode the secret, HMAC-SHA256 over '{webhook-id}.{webhook-timestamp}.{rawBody}', base64-compare; signature header is space-separated 'v1,<b64sig>' entries; reject outside a 3-minute replay window. RAW body required.",
    "raw_status_values": ["created", "started", "processing", "completed", "failed", "cancelled", "payment.succeeded", "payment.failed", "refund.succeeded"],
    "status_map": {
      "created": "pending",
      "started": "pending",
      "processing": "pending",
      "completed": "paid",
      "payment.succeeded": "paid",
      "failed": "failed",
      "cancelled": "failed",
      "payment.failed": "failed",
      "refunded": "refunded",
      "refund.succeeded": "refunded"
    }
  },
  "capabilities": {
    "redirect": true,
    "poll": true,
    "webhook": true,
    "mobile_push": false,
    "refund": true,
    "recurring": false
  },
  "credentials_required": [
    { "key": "secretKey", "label": "Secret Key (sk_)", "secret": true, "note": "server-side auth for all Checkout API calls; sk_test_ vs sk_live_ selects the mode (single host)" },
    { "key": "webhookSecret", "label": "Webhook Signing Secret (whsec_)", "secret": true, "note": "returned ONCE when the webhook is registered via POST /api/webhooks; ManishaPay captures and stores it — the merchant does not supply it" }
  ],
  "sandbox": {
    "test_credentials": { "note": "test keys are instant from the Yoco dashboard (Sell Online -> Payment Gateway -> API keys), no KYC; live keys require KYC" },
    "test_cards": [
      { "number": "4111111111111111", "result": "success" },
      { "number": "5105105105105100", "result": "decline" }
    ],
    "notes": "Any future expiry, any CVV. ZAR only, card only, minimum charge R2.00 (200 cents)."
  },
  "pain_points": [
    { "problem": "100x over/undercharge", "cause": "amount sent in Rand instead of cents (Yoco expects minor subunits)", "mitigation": "Single major-unit amount in the ManishaPay API; convert to integer cents internally (× 100) and guard the R2.00 minimum before the call", "severity": "high", "source": "https://developer.yoco.com/online/api-reference/checkout" },
    { "problem": "Charge rejected as below minimum", "cause": "amount below R2.00 (200 cents), Yoco's hard floor", "mitigation": "Enforce a 200-cent minimum locally and return a clear resolution before hitting the API", "severity": "medium", "source": "https://developer.yoco.com/online/resources/testing" },
    { "problem": "Order marked paid on a spoofed / premature successUrl redirect", "cause": "treating the browser return to successUrl as proof of payment", "mitigation": "Never trust successUrl; confirm on the payment.succeeded webhook or re-fetch GET /checkouts/{id} server-side before fulfilling", "severity": "critical", "source": "https://developer.yoco.com/online/resources/webhooks" },
    { "problem": "Webhook signature verification fails", "cause": "Svix scheme is easy to get wrong — signing the wrong content, not base64-decoding the whsec_ secret, or hashing a re-serialised body", "mitigation": "One central Svix verifier: strip whsec_, base64-decode the secret, HMAC-SHA256 over '{id}.{timestamp}.{rawBody}' on the RAW bytes, base64 constant-time compare, 3-minute replay window", "severity": "critical", "source": "https://docs.svix.com/receiving/verifying-payloads/how-manual" },
    { "problem": "Double-charge on retry", "cause": "no idempotency applied by default; a network retry re-creates the checkout", "mitigation": "Attach an Idempotency-Key header on every create/refund (derived from the merchant reference)", "severity": "high", "source": "https://developer.yoco.com/online/api-reference" },
    { "problem": "Sparse / shifting documentation", "cause": "Yoco's online gateway docs are thin and occasionally change endpoints", "mitigation": "Hide Yoco behind the ManishaPay neutral API so integrators never touch the raw surface", "severity": "medium", "source": "https://developer.yoco.com/online" },
    { "problem": "No native recurring or disputes API", "cause": "Yoco Online is single-charge, card-only; disputes are not exposed programmatically", "mitigation": "Emulate recurring in ManishaPay (stored consent + scheduled charges) or route recurring elsewhere; disputes cannot be auto-mapped, so 'disputed' is never emitted", "severity": "medium", "source": "https://developer.yoco.com/online/api-reference" }
  ],
  "sdks": { "node": "none — REST-direct", "php": "yoco/yoco-php (light, unofficial)", "rest_direct_ok": true },
  "notes": "South Africa only, ZAR only, card only (all 3DS-backed), minimum charge R2.00. No EFT, no recurring, no disputes API. Single host payments.yoco.com — TEST vs LIVE is decided by the sk_test_/sk_live_ key prefix. Webhook secret (whsec_) is issued once on POST /api/webhooks registration and captured by ManishaPay, not supplied by the merchant. Refunds via POST /api/checkouts/{id}/refund (optional partial amount in cents).",
  "sources": [
    "https://developer.yoco.com/online/api-reference",
    "https://developer.yoco.com/online/api-reference/checkout",
    "https://developer.yoco.com/online/resources/webhooks",
    "https://developer.yoco.com/online/resources/testing",
    "https://docs.svix.com/receiving/verifying-payloads/how-manual"
  ],
  "verification": {
    "verified": true,
    "unverified_fields": ["exact checkout raw_status_values enum", "public-key (pk_) usage in server flow"],
    "last_updated": "2026-07-18"
  }
}
